{
  "$schema": "https://json-schema.org/draft/2020-12/schema",
  "$id": "orchestra.compliance-registry.readme-machine-index.v1",
  "title": "Compliance Registry Machine Repository Index",
  "type": "object",
  "required": [
    "$schema",
    "schema_version",
    "document_role",
    "authority",
    "human_readme",
    "repository",
    "purpose",
    "source_state",
    "trusted_release",
    "representation",
    "records",
    "coverage",
    "domains",
    "source_model",
    "obligation_model",
    "governance",
    "validation",
    "query_and_context",
    "documentation",
    "roadmap"
  ],
  "properties": {
    "$schema": {"const": "./schema/readme-machine-index.schema.json"},
    "schema_version": {"const": "orchestra.compliance-registry.readme-machine-index.v1"},
    "document_role": {"const": "machine_repository_index"},
    "authority": {"const": "DERIVED_AND_PARITY_VALIDATED_PROJECTION"},
    "human_readme": {"const": "README.md"},
    "repository": {"type": "object", "minProperties": 1},
    "purpose": {"type": "object", "minProperties": 1},
    "source_state": {"type": "object", "minProperties": 1},
    "trusted_release": {"type": "object", "minProperties": 1},
    "representation": {"type": "object", "minProperties": 1},
    "records": {"type": "object", "minProperties": 1},
    "coverage": {"type": "object", "minProperties": 1},
    "domains": {"type": "object", "minProperties": 1},
    "source_model": {"type": "object", "minProperties": 1},
    "obligation_model": {"type": "object", "minProperties": 1},
    "governance": {"type": "object", "minProperties": 1},
    "validation": {"type": "object", "minProperties": 1},
    "query_and_context": {"type": "object", "minProperties": 1},
    "documentation": {"type": "object", "minProperties": 1},
    "roadmap": {"type": "object", "minProperties": 1}
  },
  "additionalProperties": false
}
