{
  "$schema": "./schema/readme-machine-index.schema.json",
  "schema_version": "orchestra.compliance-registry.readme-machine-index.v1",
  "document_role": "machine_repository_index",
  "authority": "DERIVED_AND_PARITY_VALIDATED_PROJECTION",
  "human_readme": "README.md",
  "repository": {
    "name": "Orchestra Compliance Registry",
    "owner": "Baelfyre",
    "full_name": "Baelfyre/Orchestra-Compliance-Registry",
    "url": "https://github.com/Baelfyre/Orchestra-Compliance-Registry",
    "canonical_branch": "main",
    "visibility": "PUBLIC",
    "license_state": "UNRESOLVED_NO_LICENSE_GRANT_INFERRED"
  },
  "purpose": {
    "summary": "Public, versioned compliance intelligence for governed software and AI-assisted development.",
    "registry_role": "Normalize reviewed compliance sources into provenance-bound machine records and evidence-oriented obligations that can be queried by humans and AI tooling without converting source discovery, documentation, validation, or platform policy into legal advice or execution authority.",
    "current_program": "INTERNATIONAL_PRIVACY_SOURCE_BACKED_PILOT",
    "planned_expansion_domains": ["software-development", "cybersecurity", "database-and-data-governance", "ai-usage-and-ai-systems", "accessibility", "provider-and-platform-requirements"],
    "not_legal_advice": true,
    "project_applicability_requires_review": true
  },
  "source_state": {
    "authority_path": "registry/manifest.json",
    "registry_version": "0.2.0-dev.1",
    "release_sequence": 0,
    "status": "DRAFT",
    "record_counts": {"sources": 8, "obligations": 15, "jurisdictions": 7, "providers": 7, "source_status": 8, "review_due": 8}
  },
  "trusted_release": {
    "state": "PUBLISHED_IMMUTABLE_VERIFIED",
    "tag": "registry-v0.2.0",
    "release_id": 373113025,
    "registry_version": "0.2.0",
    "release_sequence": 2,
    "target_commit": "cb32038a2683eb2c19f52646892d3257996a06eb",
    "source_tree": "10ce7849fd5b95b3ca756eff213bb506d00a89de",
    "published_at": "2026-08-19T14:20:56Z",
    "draft": false,
    "prerelease": false,
    "immutable": true,
    "release_manifest_sha256": "cb98e4496da8952cff1432207d57f04379364bac2e95cc422de173681a8fb2b4",
    "bundle_sha256": "71414aaead10634c2a4b79ec519b4fc76fb32af71cd831ef48f2133bcc211388",
    "release_evidence": "machine/release-evidence-v0.2.0.json",
    "publication_reverification_required": true,
    "scope_note": "The trusted v0.2.0 release is the immutable bounded international privacy pilot. Editable repository state remains a separate DRAFT source and must not be treated as trusted publication merely because it validates."
  },
  "representation": {
    "human_entry_point": {"path": "README.md", "role": "COMPACT_HUMAN_ORIENTATION", "authority": "NON_AUTHORITATIVE_HUMAN_READABLE_REFERENCE"},
    "machine_entry_point": {"path": "README.json", "role": "COMPLETE_MACHINE_REPOSITORY_INDEX", "authority": "DERIVED_AND_PARITY_VALIDATED_PROJECTION"},
    "editable_registry_authority": "registry/manifest.json",
    "machine_control_metadata": "machine/",
    "human_documentation": "docs/",
    "schema_contracts": "schema/",
    "toon_policy": "DERIVED_NON_AUTHORITATIVE_CONTEXT_ONLY_WHEN_MEASURED_BENEFIT_EXISTS",
    "markdown_must_not_override_machine_state": true,
    "machine_state_must_not_be_reconstructed_from_markdown_when_json_exists": true
  },
  "records": {
    "manifest": {"path": "registry/manifest.json", "role": "EDITABLE_REGISTRY_SOURCE_STATE_AND_RECORD_MAP"},
    "sources": {"path": "registry/sources.json", "role": "PRIMARY_AND_REGULATORY_SOURCE_IDENTITIES_WITH_VERIFICATION_METADATA"},
    "obligations": {"path": "registry/obligations.json", "role": "BOUNDED_EVIDENCE_ORIENTED_OBLIGATIONS_WITH_DIRECT_SOURCE_LOCATORS"},
    "jurisdictions": {"path": "registry/jurisdictions.json", "role": "JURISDICTION_CATALOG_AND_COVERAGE_MATURITY"},
    "providers": {"path": "registry/providers.json", "role": "PROVIDER_AND_PLATFORM_CATALOG"},
    "source_status": {"path": "registry/source-status.json", "role": "SOURCE_CURRENTNESS_LEDGER"},
    "review_due": {"path": "registry/review-due.json", "role": "SOURCE_REVIEW_CADENCE_AND_FRESHNESS_LEDGER"},
    "capabilities": {"path": "registry/capabilities.json", "role": "DESCRIPTIVE_NON_AUTHORIZING_CAPABILITY_NEGOTIATION_SURFACE"},
    "publication_state": {"path": "machine/publication-state.json", "role": "LAST_VERIFIED_SOURCE_AND_TRUSTED_PUBLICATION_IDENTITY"},
    "representation_policy": {"path": "machine/representation-policy.json", "role": "MACHINE_HUMAN_AND_DERIVED_CONTEXT_REPRESENTATION_BOUNDARY"},
    "source_provenance_audit": {"path": "machine/source-provenance-audit.v1.json", "role": "EVIDENCE_ONLY_OFFICIAL_SOURCE_AND_DATE_PROVENANCE_AUDIT"},
    "release_evidence_v0_2_0": {"path": "machine/release-evidence-v0.2.0.json", "role": "TRUSTED_RELEASE_PUBLICATION_EVIDENCE"},
    "source_monitor_policy": {"path": "machine/source-monitor-policy.json", "role": "OFFICIAL_SOURCE_MONITOR_POLICY_AND_AUTOMATION_BOUNDARY"},
    "source_monitor_baseline": {"path": "machine/source-monitor-baseline.v1.json", "role": "REVIEWED_OFFICIAL_SOURCE_FINGERPRINT_BASELINE"}
  },
  "coverage": {
    "coverage_status_semantics": {
      "SOURCE_BACKED_PILOT": "Reviewed primary sources and a bounded evidence-oriented obligation set exist; completeness and project applicability are not implied.",
      "FOUNDATION_ONLY": "The jurisdiction or provider is structurally registered but no source-backed obligation set is asserted."
    },
    "jurisdictions": [
      {"jurisdiction_id": "PH", "name": "Philippines", "kind": "COUNTRY", "status": "SOURCE_BACKED_PILOT", "source_count": 4, "obligation_count": 6, "current_scope": ["privacy", "data-protection", "security", "privacy-engineering", "systems-lifecycle"]},
      {"jurisdiction_id": "EU-EEA", "name": "European Union / European Economic Area", "kind": "REGIONAL_FRAMEWORK", "status": "SOURCE_BACKED_PILOT", "source_count": 1, "obligation_count": 3, "current_scope": ["privacy", "data-protection", "security", "privacy-engineering", "risk-management"]},
      {"jurisdiction_id": "CA", "name": "Canada", "kind": "COUNTRY_WITH_SUBJURISDICTIONS", "status": "SOURCE_BACKED_PILOT", "source_count": 1, "obligation_count": 2, "current_scope": ["privacy", "data-protection", "security", "governance", "accountability"]},
      {"jurisdiction_id": "AU", "name": "Australia", "kind": "COUNTRY_WITH_SUBJURISDICTIONS", "status": "SOURCE_BACKED_PILOT", "source_count": 1, "obligation_count": 2, "current_scope": ["privacy", "data-protection", "security", "retention", "transparency"]},
      {"jurisdiction_id": "SG", "name": "Singapore", "kind": "COUNTRY", "status": "SOURCE_BACKED_PILOT", "source_count": 1, "obligation_count": 2, "current_scope": ["privacy", "data-protection", "security", "retention", "access-control"]},
      {"jurisdiction_id": "US", "name": "United States", "kind": "COUNTRY_WITH_SUBJURISDICTIONS", "status": "FOUNDATION_ONLY", "source_count": 0, "obligation_count": 0, "current_scope": []},
      {"jurisdiction_id": "MX", "name": "Mexico", "kind": "COUNTRY", "status": "FOUNDATION_ONLY", "source_count": 0, "obligation_count": 0, "current_scope": []}
    ],
    "providers": [
      {"provider_id": "APPLE", "name": "Apple", "kind": "PLATFORM_PROVIDER", "status": "FOUNDATION_ONLY"},
      {"provider_id": "GOOGLE_PLAY", "name": "Google Play", "kind": "DISTRIBUTION_PROVIDER", "status": "FOUNDATION_ONLY"},
      {"provider_id": "MICROSOFT_WINDOWS", "name": "Microsoft / Windows", "kind": "PLATFORM_PROVIDER", "status": "FOUNDATION_ONLY"},
      {"provider_id": "DEBIAN", "name": "Debian", "kind": "LINUX_DISTRIBUTION", "status": "FOUNDATION_ONLY"},
      {"provider_id": "FEDORA", "name": "Fedora", "kind": "LINUX_DISTRIBUTION", "status": "FOUNDATION_ONLY"},
      {"provider_id": "SNAP", "name": "Snap Store", "kind": "LINUX_DISTRIBUTION_PROVIDER", "status": "FOUNDATION_ONLY"},
      {"provider_id": "FLATHUB", "name": "Flathub", "kind": "LINUX_DISTRIBUTION_PROVIDER", "status": "FOUNDATION_ONLY"}
    ],
    "provider_policy_obligations_source_backed": false
  },
  "domains": {
    "current_source_backed": ["privacy", "data-protection", "personal-data-processing", "security", "privacy-engineering", "business-continuity", "systems-lifecycle", "risk-management", "governance", "training", "data-lifecycle", "retention", "access-control", "resilience", "data-minimization", "accountability", "transparency"],
    "next_expansion": ["software-development", "secure-software-development", "cybersecurity", "database-security", "data-governance", "data-residency", "ai-usage", "ai-systems", "ai-risk-management", "accessibility", "provider-platform-policy", "cloud-shared-responsibility", "developer-distribution-requirements"]
  },
  "source_model": {
    "current_source_types": ["STATUTE", "REGULATION", "IMPLEMENTING_RULES", "REGULATORY_CIRCULAR", "REGULATORY_ADVISORY"],
    "verification_states": ["VERIFIED_CURRENT", "CURRENT_WITH_PENDING_CHANGE", "NOT_EFFECTIVE_YET", "SUPERSEDED", "REPEALED", "SOURCE_UNAVAILABLE", "SOURCE_MOVED", "APPLICABILITY_UNRESOLVED", "HUMAN_INTERPRETATION_REQUIRED", "REVIEW_OVERDUE"],
    "canonical_source_policy": "OFFICIAL_PRIMARY_ONLY",
    "government_and_regulator_rule": "USE_ISSUING_GOVERNMENT_REGULATOR_OR_OFFICIAL_LEGISLATION_SERVICE",
    "provider_rule": "USE_PROVIDER_OFFICIAL_DEVELOPER_POLICY_LEGAL_SECURITY_COMPLIANCE_OR_DOCUMENTATION_SITE",
    "wikipedia_allowed_as_canonical_source": false,
    "social_media_allowed_as_canonical_source": false,
    "blogs_or_aggregators_allowed_as_canonical_source": false,
    "secondary_summary_may_replace_primary_authority": false,
    "structured_citation_required": true,
    "citation_fields": ["source_origin", "primary_source", "official_source", "publisher", "identifier", "official_url", "locator"],